Country Name,Country Code,Series Name,Series Code,2010 [YR2010],2011 [YR2011],2012 [YR2012],2013 [YR2013],2014 [YR2014],2015 [YR2015],2016 [YR2016],2017 [YR2017],2018 [YR2018],2019 [YR2019],2020 [YR2020]
"Bahamas, The",BHS,"Employers, male (% of male employment) (modeled ILO estimate)",SL.EMP.MPYR.MA.ZS,4.638997,4.763419,4.732265,4.777181,4.725657,4.71359,4.651163,4.657614,4.690743,4.728534,4.828164
"Bahamas, The",BHS,"Employment to population ratio, 15+, total (%) (national estimate)",SL.EMP.TOTL.SP.NE.ZS,..,62.1,64.05,..,..,..,..,..,..,..,..
"Bahamas, The",BHS,"Part time employment, total (% of total employment)",SL.TLF.PART.ZS,..,..,..,..,..,..,..,..,..,..,..
"Bahamas, The",BHS,"Self-employed, male (% of male employment) (modeled ILO estimate)",SL.EMP.SELF.MA.ZS,19.76583,20.49733,20.74714,21.27518,21.39583,21.65082,21.6743,21.73675,21.9033,21.95968,21.81395
"Bahamas, The",BHS,"Self-employed, female (% of female employment) (modeled ILO estimate)",SL.EMP.SELF.FE.ZS,7.789497,8.031359,7.595214,7.710584,7.613492,7.642735,7.495639,7.452057,7.582135,7.573655,8.091706
"Bahamas, The",BHS,"International tourism, receipts for travel items (current US$)",ST.INT.TVLR.CD,2147000000,2142000000,2311000000,2285000000,2316000000,2537000000,3074000000,2930000000,3728000000,4125000000,1002000000
"Bahamas, The",BHS,"International tourism, receipts (current US$)",ST.INT.RCPT.CD,2159000000,2157000000,2333000000,2305000000,2336000000,2554000000,3091000000,2951000000,3756000000,4150000000,1007000000
"Bahamas, The",BHS,"International tourism, number of departures",ST.INT.DPRT,..,..,..,..,..,..,..,..,..,..,..
"Bahamas, The",BHS,"International tourism, expenditures for travel items (current US$)",ST.INT.TVLX.CD,228000000,246000000,286000000,262000000,212000000,238000000,329000000,371000000,332000000,335000000,110000000
"Bahamas, The",BHS,"International tourism, expenditures (current US$)",ST.INT.XPND.CD,369000000,347000000,384000000,362000000,328000000,347000000,440000000,554000000,519000000,514000000,166000000
"Bahamas, The",BHS,"International tourism, receipts for passenger transport items (current US$)",ST.INT.TRNR.CD,12000000,15000000,22000000,20000000,20000000,17000000,17000000,21000000,28000000,25000000,5000000
"Bahamas, The",BHS,"International tourism, receipts (% of total exports)",ST.INT.RCPT.XP.ZS,67.5530223954383,64.830318588268,63.4761774966965,63.5659709984739,65.6410997354632,74.7650126305566,79.6401910996496,78.4280042032136,79.0423234348996,80.3665977076924,61.0174111334939
"Bahamas, The",BHS,"International tourism, expenditures for passenger transport items (current US$)",ST.INT.TRNX.CD,141000000,101000000,98000000,100000000,116000000,109000000,111000000,183000000,187000000,179000000,56000000
"Bahamas, The",BHS,"International tourism, expenditures (% of total imports)",ST.INT.XPND.MP.ZS,9.78106063276836,8.14922618752661,7.79992224452512,7.55077163880112,6.46679718493207,8.19963855548934,9.84966144163229,11.2568075863374,10.1440426851153,10.6206782368945,4.86689191542631
"Bahamas, The",BHS,"International tourism, number of arrivals",ST.INT.ARVL,5255000,5588000,5940000,6151000,6320000,6112000,6265000,6136000,6622000,7250000,1794500
"Bahamas, The",BHS,Income share held by highest 10%,SI.DST.10TH.10,..,..,..,..,..,..,..,..,..,..,..
"Bahamas, The",BHS,Income share held by lowest 10%,SI.DST.FRST.10,..,..,..,..,..,..,..,..,..,..,..
"Bahamas, The",BHS,Income share held by second 20%,SI.DST.02ND.20,..,..,..,..,..,..,..,..,..,..,..
"Bahamas, The",BHS,Proportion of people living below 50 percent of median income (%),SI.DST.50MD,..,..,..,..,..,..,..,..,..,..,..
"Bahamas, The",BHS,Income share held by third 20%,SI.DST.03RD.20,..,..,..,..,..,..,..,..,..,..,..
"Bahamas, The",BHS,Income share held by lowest 20%,SI.DST.FRST.20,..,..,..,..,..,..,..,..,..,..,..
"Bahamas, The",BHS,Income share held by highest 20%,SI.DST.05TH.20,..,..,..,..,..,..,..,..,..,..,..
"Bahamas, The",BHS,Income share held by fourth 20%,SI.DST.04TH.20,..,..,..,..,..,..,..,..,..,..,..
"Bahamas, The",BHS,Market capitalization of listed domestic companies (% of GDP),CM.MKT.LCAP.GD.ZS,..,..,..,..,..,..,..,..,..,..,..
"Bahamas, The",BHS,"Listed domestic companies, total",CM.MKT.LDOM.NO,..,..,..,..,..,..,..,..,..,..,..
"Bahamas, The",BHS,Adjusted net national income per capita (annual % growth),NY.ADJ.NNTY.PC.KD.ZG,-4.23396724736487,-2.37011268342559,4.70351766770429,-4.66800694605277,1.37068625521222,2.33694841770054,0.412627967075025,2.97205036695468,-0.749286420924321,1.2715226254363,-25.5970613351509
"Bahamas, The",BHS,Adjusted net national income (annual % growth),NY.ADJ.NNTY.KD.ZG,-2.87705823380178,-1.14657431765762,5.84238831496432,-3.77247842293573,2.2856904270115,3.27476513766764,1.25106830938483,3.76363097112515,-0.0314337834895895,1.93951665010883,-25.2450535226436
"Bahamas, The",BHS,Adjusted savings: education expenditure (% of GNI),NY.ADJ.AEDU.GN.ZS,3.8356,3.8356,3.8356,3.8356,3.8356,3.8356,3.8356,3.8356,3.8356,3.8356,3.8356
"Bahamas, The",BHS,"Employers, female (% of female employment) (modeled ILO estimate)",SL.EMP.MPYR.FE.ZS,1.058342,1.099217,1.006317,1.001861,0.9648044,0.9573865,0.9180114,0.9237661,0.9365463,0.9666401,1.035696
"Bahamas, The",BHS,"Contributing family workers, male (% of male employment) (modeled ILO estimate)",SL.FAM.WORK.MA.ZS,0.2761952,0.3126855,0.3091271,0.3070819,0.3018724,0.2956865,0.2896259,0.2838005,0.2737109,0.2705131,0.2971928
"Bahamas, The",BHS,"Contributing family workers, total (% of total employment) (modeled ILO estimate)",SL.FAM.WORK.ZS,0.2918956,0.3015166,0.31068,0.3046547,0.2984124,0.2909896,0.285739,0.2780065,0.2677671,0.2621015,0.2738686
"Bahamas, The",BHS,"Employment in services, male (% of male employment) (modeled ILO estimate)",SL.SRV.EMPL.MA.ZS,70.77422,73.3433,73.49995,74.60718,74.96665,75.50634,75.73526,75.59772,75.4891,75.57484,75.83969
"Bahamas, The",BHS,"Employment in services, female (% of female employment) (modeled ILO estimate)",SL.SRV.EMPL.FE.ZS,95.11488,94.7041,94.83931,95.10305,95.15115,95.29812,95.3816,95.408,95.43197,95.48869,95.25666
"Bahamas, The",BHS,"Employment in industry, male (% of male employment) (modeled ILO estimate)",SL.IND.EMPL.MA.ZS,23.86868,21.12482,20.94939,19.91178,19.64177,19.17227,19.04385,19.25829,19.40408,19.4007,19.27368
"Bahamas, The",BHS,Employment in services (% of total employment) (modeled ILO estimate),SL.SRV.EMPL.ZS,82.2516,83.36709,83.66185,84.32499,84.4645,84.80502,84.89702,84.89369,85.04999,85.12869,85.16857
"Bahamas, The",BHS,"Employment in industry, female (% of female employment) (modeled ILO estimate)",SL.IND.EMPL.FE.ZS,3.965143,3.690829,3.560725,3.361384,3.28372,3.13604,3.109464,3.120162,3.113842,3.099745,3.239843
"Bahamas, The",BHS,Employment in industry (% of total employment) (modeled ILO estimate),SL.IND.EMPL.ZS,14.4826,12.94327,12.66982,12.06466,11.94446,11.63805,11.6131,11.68548,11.59431,11.58016,11.5693
"Bahamas, The",BHS,GDP per person employed (constant 2017 PPP $),SL.GDP.PCAP.EM.KD,73353.9127370734,72538.4173412497,72966.2408985566,71655.7803388281,69830.5352763765,68045.4534937365,67485.7437176693,65838.8723984963,65996.8080483287,64696.5350567381,53047.7056718622
,,,,,,,,,,,,,,
,,,,,,,,,,,,,,
,,,,,,,,,,,,,,
Data from database: World Development Indicators,,,,,,,,,,,,,,
Last Updated: 10/26/2023,,,,,,,,,,,,,,
Code,License Type,Indicator Name,Short definition,Long definition,Source,Topic,Unit of measure,Periodicity,Base Period,Aggregation method,Statistical concept and methodology,Development relevance,Limitations and exceptions,General comments,Notes from original source,Related source links,License URL
SL.EMP.MPYR.MA.ZS,CC BY-4.0,"Employers, male (% of male employment) (modeled ILO estimate)",,"Employers are those workers who, working on their own account or with one or a few partners, hold the type of jobs defined as a "self-employment jobs" i.e. jobs where the remuneration is directly dependent upon the profits derived from the goods and services produced), and, in this capacity, have engaged, on a continuous basis, one or more persons to work for them as employee(s).",International Labour Organization. “ILO modelled estimates database” ILOSTAT. Accessed January 2021. https://ilostat.ilo.org/data/.,Social Protection & Labor: Economic activity,,Annual,,Weighted average,"The status in employment distinguishes between two categories of the total employed: (a) wage and salaried workers (also known as employees); and (b) self-employed workers, with the subcategories: (i) self-employed workers with employees (employers), (ii) self-employed workers without employees (own-account workers), and (iii) members of producers' cooperatives and contributing family workers (also known as unpaid family workers). Vulnerable employment refers to the sum of (ii) own-account workers and (iii) contributing family workers.

The series is part of the "ILO modeled estimates database," including nationally reported observations and imputed data for countries with missing data, primarily to capture regional and global trends with consistent country coverage. Country-reported microdata is based mainly on nationally representative labor force surveys, with other sources (e.g., household surveys and population censuses) considering differences in the data source, the scope of coverage, methodology, and other country-specific factors. Country analysis requires caution where limited nationally reported data are available. A series of models are also applied to impute missing observations and make projections. However, imputed observations are not based on national data, are subject to high uncertainty, and should not be used for country comparisons or rankings. For more information: https://ilostat.ilo.org/resources/concepts-and-definitions/ilo-modelled-estimates/","Breaking down employment information by status in employment provides a statistical basis for describing workers' behaviour and conditions of work, and for defining an individual's socio-economic group. A high proportion of wage and salaried workers in a country can signify advanced economic development. If the proportion of own-account workers (self-employed without hired employees) is sizeable, it may be an indication of a large agriculture sector and low growth in the formal economy. A high proportion of contributing family workers — generally unpaid, although compensation might come indirectly in the form of family income — may indicate weak development, little job growth, and often a large rural economy.

Each status group faces different economic risks, and contributing family workers and own-account workers are the most vulnerable - and therefore the most likely to fall into poverty. They are the least likely to have formal work arrangements, are the least likely to have social protection and safety nets to guard against economic shocks, and often are incapable of generating sufficient savings to offset these shocks.","Data are drawn from labor force surveys and household surveys, supplemented by official estimates and censuses for a small group of countries. Due to differences in definitions and coverage across countries, there are limitations for comparing data across countries and over time even within a country. Estimates of women in employment are not comparable internationally, reflecting that demographic, social, legal, and cultural trends and norms determine whether women's activities are regarded as economic.",,"Given the exceptional situation, including the scarcity of relevant data, the  ILO modeled estimates and projections from 2020 onwards are subject to substantial uncertainty.",,https://datacatalog.worldbank.org/public-licenses#cc-by
SL.EMP.TOTL.SP.NE.ZS,CC BY-4.0,"Employment to population ratio, 15+, total (%) (national estimate)",,"Employment to population ratio is the proportion of a country's population that is employed. Employment is defined as persons of working age who, during a short reference period, were engaged in any activity to produce goods or provide services for pay or profit, whether at work during the reference period (i.e. who worked in a job for at least one hour) or not at work due to temporary absence from a job, or to working-time arrangements. Ages 15 and older are generally considered the working-age population.","International Labour Organization. “Labour Force Statistics database (LFS)” ILOSTAT. Accessed September 05, 2023. https://ilostat.ilo.org/data/.",Social Protection & Labor: Economic activity,,Annual,,Weighted average,"The employment to population ratio indicates how efficiently an economy provides jobs for people who want to work. A high ratio means that a large proportion of the population is employed. But a lower employment to population ratio can be seen as a positive sign, especially for young people, if it is caused by an increase in their education.","Four targets were added to the UN Millennium Declaration at the 2005 World Summit High-Level Plenary Meeting of the 60th Session of the UN General Assembly. One was full and productive employment and decent work for all, which is seen as the main route for people to escape poverty. Employment to population ratio is a key measure to monitor whether a country is on track to achieve the Millennium Development Goal of eradicating extreme poverty and hunger by 2015. And it continues to be a priority in the Sustainable Development Goal of promoting sustained, inclusive and sustainable economic growth, full and productive employment and decent work for all.","Data on employment by status are drawn from labor force surveys and household surveys, supplemented by official estimates and censuses for a small group of countries. The labor force survey is the most comprehensive source for internationally comparable employment, but there are still some limitations for comparing data across countries and over time even within a country. 

Comparability of employment ratios across countries is affected by variations in definitions of employment and population. The biggest difference results from the age range used to define labor force activity. The population base for employment ratios can also vary. Most countries use the resident, non-institutionalized population of working age living in private households, which excludes members of the armed forces and individuals residing in mental, penal, or other types of institutions. But some countries include members of the armed forces in the population base of their employment ratio while excluding them from employment data.

The reference period of a census or survey is another important source of differences: in some countries data refer to people's status on the day of the census or survey or during a specific period before the inquiry date, while in others data are recorded without reference to any period. Employment ratios tend to vary during the year as seasonal workers enter and leave.

This indicator also has a gender bias because women who do not consider their work employment or who are not perceived as working tend to be undercounted. This bias has different effects across countries and reflects demographic, social, legal, and cultural trends and norms.",The series for ILO estimates is also available in the WDI database. Caution should be used when comparing ILO estimates with national estimates.,,,https://datacatalog.worldbank.org/public-licenses#cc-by
SL.TLF.PART.ZS,CC BY-4.0,"Part time employment, total (% of total employment)",,Part time employment refers to regular employment in which working time is substantially less than normal. Definitions of part time employment differ by country.,"International Labour Organization. “Wages and Working Time Statistics database (COND)” ILOSTAT. Accessed September 05, 2023. https://ilostat.ilo.org/data/.",Social Protection & Labor: Economic activity,,Annual,,Weighted average,,,,Relevance to gender indicator: More and more women are working part-time and one of the concern is that part time work does not provide the stability that full time work does.,,,https://datacatalog.worldbank.org/public-licenses#cc-by
SL.EMP.SELF.MA.ZS,CC BY-4.0,"Self-employed, male (% of male employment) (modeled ILO estimate)",,"Self-employed workers are those workers who, working on their own account or with one or a few partners or in cooperative, hold the type of jobs defined as a "self-employment jobs." i.e. jobs where the remuneration is directly dependent upon the profits derived from the goods and services produced. Self-employed workers include four sub-categories of employers, own-account workers, members of producers' cooperatives, and contributing family workers.",International Labour Organization. “ILO modelled estimates database” ILOSTAT. Accessed January 2021. https://ilostat.ilo.org/data/.,Social Protection & Labor: Economic activity,,Annual,,Weighted average,"The status in employment distinguishes between two categories of the total employed: (a) wage and salaried workers (also known as employees); and (b) self-employed workers, with the subcategories: (i) self-employed workers with employees (employers), (ii) self-employed workers without employees (own-account workers), and (iii) members of producers' cooperatives and contributing family workers (also known as unpaid family workers). Vulnerable employment refers to the sum of (ii) own-account workers and (iii) contributing family workers.

The series is part of the "ILO modeled estimates database," including nationally reported observations and imputed data for countries with missing data, primarily to capture regional and global trends with consistent country coverage. Country-reported microdata is based mainly on nationally representative labor force surveys, with other sources (e.g., household surveys and population censuses) considering differences in the data source, the scope of coverage, methodology, and other country-specific factors. Country analysis requires caution where limited nationally reported data are available. A series of models are also applied to impute missing observations and make projections. However, imputed observations are not based on national data, are subject to high uncertainty, and should not be used for country comparisons or rankings. For more information: https://ilostat.ilo.org/resources/concepts-and-definitions/ilo-modelled-estimates/","Breaking down employment information by status in employment provides a statistical basis for describing workers' behaviour and conditions of work, and for defining an individual's socio-economic group. A high proportion of wage and salaried workers in a country can signify advanced economic development. If the proportion of own-account workers (self-employed without hired employees) is sizeable, it may be an indication of a large agriculture sector and low growth in the formal economy. A high proportion of contributing family workers — generally unpaid, although compensation might come indirectly in the form of family income — may indicate weak development, little job growth, and often a large rural economy.

Each status group faces different economic risks, and contributing family workers and own-account workers are the most vulnerable - and therefore the most likely to fall into poverty. They are the least likely to have formal work arrangements, are the least likely to have social protection and safety nets to guard against economic shocks, and often are incapable of generating sufficient savings to offset these shocks.","Data are drawn from labor force surveys and household surveys, supplemented by official estimates and censuses for a small group of countries. Due to differences in definitions and coverage across countries, there are limitations for comparing data across countries and over time even within a country. Estimates of women in employment are not comparable internationally, reflecting that demographic, social, legal, and cultural trends and norms determine whether women's activities are regarded as economic.",,"Given the exceptional situation, including the scarcity of relevant data, the  ILO modeled estimates and projections from 2020 onwards are subject to substantial uncertainty.",,https://datacatalog.worldbank.org/public-licenses#cc-by
SL.EMP.SELF.FE.ZS,CC BY-4.0,"Self-employed, female (% of female employment) (modeled ILO estimate)",,"Self-employed workers are those workers who, working on their own account or with one or a few partners or in cooperative, hold the type of jobs defined as a "self-employment jobs." i.e. jobs where the remuneration is directly dependent upon the profits derived from the goods and services produced. Self-employed workers include four sub-categories of employers, own-account workers, members of producers' cooperatives, and contributing family workers.",International Labour Organization. “ILO modelled estimates database” ILOSTAT. Accessed January 2021. https://ilostat.ilo.org/data/.,Social Protection & Labor: Economic activity,,Annual,,Weighted average,"The status in employment distinguishes between two categories of the total employed: (a) wage and salaried workers (also known as employees); and (b) self-employed workers, with the subcategories: (i) self-employed workers with employees (employers), (ii) self-employed workers without employees (own-account workers), and (iii) members of producers' cooperatives and contributing family workers (also known as unpaid family workers). Vulnerable employment refers to the sum of (ii) own-account workers and (iii) contributing family workers.

The series is part of the "ILO modeled estimates database," including nationally reported observations and imputed data for countries with missing data, primarily to capture regional and global trends with consistent country coverage. Country-reported microdata is based mainly on nationally representative labor force surveys, with other sources (e.g., household surveys and population censuses) considering differences in the data source, the scope of coverage, methodology, and other country-specific factors. Country analysis requires caution where limited nationally reported data are available. A series of models are also applied to impute missing observations and make projections. However, imputed observations are not based on national data, are subject to high uncertainty, and should not be used for country comparisons or rankings. For more information: https://ilostat.ilo.org/resources/concepts-and-definitions/ilo-modelled-estimates/","Breaking down employment information by status in employment provides a statistical basis for describing workers' behaviour and conditions of work, and for defining an individual's socio-economic group. A high proportion of wage and salaried workers in a country can signify advanced economic development. If the proportion of own-account workers (self-employed without hired employees) is sizeable, it may be an indication of a large agriculture sector and low growth in the formal economy. A high proportion of contributing family workers — generally unpaid, although compensation might come indirectly in the form of family income — may indicate weak development, little job growth, and often a large rural economy.

Each status group faces different economic risks, and contributing family workers and own-account workers are the most vulnerable - and therefore the most likely to fall into poverty. They are the least likely to have formal work arrangements, are the least likely to have social protection and safety nets to guard against economic shocks, and often are incapable of generating sufficient savings to offset these shocks.","Data are drawn from labor force surveys and household surveys, supplemented by official estimates and censuses for a small group of countries. Due to differences in definitions and coverage across countries, there are limitations for comparing data across countries and over time even within a country. Estimates of women in employment are not comparable internationally, reflecting that demographic, social, legal, and cultural trends and norms determine whether women's activities are regarded as economic.",,"Given the exceptional situation, including the scarcity of relevant data, the  ILO modeled estimates and projections from 2020 onwards are subject to substantial uncertainty.",,https://datacatalog.worldbank.org/public-licenses#cc-by
ST.INT.TVLR.CD,CC BY-4.0,"International tourism, receipts for travel items (current US$)",,"International tourism receipts for travel items are expenditures by international inbound visitors in the reporting economy. The goods and services are purchased by, or on behalf of, the traveler or provided, without a quid pro quo, for the traveler to use or give away. These receipts should include any other prepayment made for goods or services received in the destination country. They also may include receipts from same-day visitors, except in cases where these are so important as to justify a separate classification. Excluded is the international carriage of travelers, which is covered in passenger travel items. Data are in current U.S. dollars.","World Tourism Organization, Yearbook of Tourism Statistics, Compendium of Tourism Statistics and data files.",Private Sector & Trade: Travel & tourism,,Annual,,Gap-filled total,,,,,,,https://datacatalog.worldbank.org/public-licenses#cc-by
