ST.INT.XPND.MP.ZS,CC BY-4.0,"International tourism, expenditures (% of total imports)",,"International tourism expenditures are expenditures of international outbound visitors in other countries, including payments to foreign carriers for international transport. These expenditures may include those by residents traveling abroad as same-day visitors, except in cases where these are important enough to justify separate classification. For some countries they do not include expenditures for passenger transport items. Their share in imports is calculated as a ratio to imports of goods and services, which comprise all transactions between residents of a country and the rest of the world involving a change of ownership from nonresidents to residents of general merchandise, goods sent for processing and repairs, nonmonetary gold, and services.","World Tourism Organization, Yearbook of Tourism Statistics, Compendium of Tourism Statistics and data files, and IMF and World Bank imports estimates.",Private Sector & Trade: Travel & tourism,,Annual,,Weighted average,"Outbound tourism expenditures may include those by residents traveling abroad as same-day visitors, except when these are important enough to justify separate classification. For some countries they do not include expenditures for passenger transport items. Their share in imports is calculated as a ratio to imports of goods and services (all transactions between residents of a country and the rest of the world involving a change of ownership from nonresidents to residents of general merchandise, goods sent for processing and repairs, nonmonetary gold, and services).

International tourism expenditures' share in imports is calculated as a ratio to imports of goods and services, which comprise all transactions between residents of a country and the rest of the world involving a change of ownership from nonresidents to residents of general merchandise, goods sent for processing and repairs, nonmonetary gold, and services.

Statistical information on tourism is based mainly on data on arrivals and overnight stays along with balance of payments information. These data do not completely capture the economic phenomenon of tourism or provide the information needed for effective public policies and efficient business operations. Data are needed on the scale and significance of tourism. Information on the role of tourism in national economies is particularly deficient. Although the World Tourism Organization reports progress in harmonizing definitions and measurement, differences in national practices still prevent full comparability.

The World Tourism Organization is improving its coverage of tourism expenditure data, using balance of payments data from the International Monetary Fund (IMF) supplemented by data from individual countries. These data include travel and passenger transport items as defined in the IMF's Balance of Payments. When the IMF does not report data on passenger transport items, expenditure data for travel items are shown.

The aggregates are calculated using the World Bank's weighted aggregation methodology and differ from the World Tourism Organization's aggregates.","Tourism is officially recognized as a directly measurable activity, enabling more accurate analysis and more effective policy. Whereas previously the sector relied mostly on approximations from related areas of measurement (e.g. Balance of Payments statistics), tourism today possesses a range of instruments to track its productive activities and the activities of the consumers that drive them: visitors (both tourists and excursionists).

An increasing number of countries have opened up and invested in tourism development, making tourism a key driver of socio-economic progress through export revenues, the creation of jobs and enterprises, and infrastructure development. As an internationally traded service, inbound tourism has become one of the world's major trade categories. For many developing countries it is one of the main sources of foreign exchange income and a major component of exports, creating much needed employment and development opportunities.

This measure reflects the importance of tourism as an internationally traded service relative to other categories of imports. Such a measure reveals the predilection for tourism in a country's import structure and the relative degree of an economy's domestic revenue outflows due to international tourism.","Tourism can be either domestic or international. The data refers to international tourism, where the traveler's country of residence differs from the visiting country. International tourism consists of inbound (arrival) and outbound (departures) tourism.

The data are from the World Tourism Organization (WTO), a United Nations agency. The data on inbound and outbound tourists refer to the number of arrivals and departures, not to the number of people traveling.

Expenditure associated with the activity of international visitors has been traditionally identified with the travel item of the Balance of Payments (BOP).

The 2008 International Recommendations for Tourism Statistics consider that "tourism industries and products" includes transport of passengers. Consequently, a better estimate of tourism-related expenditure by inbound and outbound visitors in an international scenario would be, in terms of the BOP, the value of the travel item plus that of the passenger transport item.

Nevertheless, users should be aware that BOP estimates include, in addition to expenditures associated to visitors, those related to other types of travelers (these might be substantial in some countries; for instance, long-term students or patients, border and seasonal workers, etc.). Also data on expenditure by main purpose of the trip are BOP data.",,,,https://datacatalog.worldbank.org/public-licenses#cc-by
ST.INT.ARVL,CC BY-4.0,"International tourism, number of arrivals","International inbound tourists (overnight visitors) are the number of tourists who travel to a country other than that in which they usually reside, and outside their usual environment, for a period not exceeding 12 months and whose main purpose in visiting is other than an activity remunerated from within the country visited. When data on number of tourists are not available, the number of visitors, which includes tourists, same-day visitors, cruise passengers, and
crew members, is shown instead.","International inbound tourists (overnight visitors) are the number of tourists who travel to a country other than that in which they have their usual residence, but outside their usual environment, for a period not exceeding 12 months and whose main purpose in visiting is other than an activity remunerated from within the country visited. When data on number of tourists are not available, the number of visitors, which includes tourists, same-day visitors, cruise passengers, and crew members, is shown instead. Sources and collection methods for arrivals differ across countries. In some cases data are from border statistics (police, immigration, and the like) and supplemented by border surveys. In other cases data are from tourism accommodation establishments. For some countries number of arrivals is limited to arrivals by air and for others to arrivals staying in hotels. Some countries include arrivals of nationals residing abroad while others do not. Caution should thus be used in comparing arrivals across countries. The data on inbound tourists refer to the number of arrivals, not to the number of people traveling. Thus a person who makes several trips to a country during a given period is counted each time as a new arrival.","World Tourism Organization, Yearbook of Tourism Statistics, Compendium of Tourism Statistics and data files.",Private Sector & Trade: Travel & tourism,,Annual,,Gap-filled total,"Statistical information on tourism is based mainly on data on arrivals and overnight stays along with balance of payments information. These data do not completely capture the economic phenomenon of tourism or provide the information needed for effective public policies and efficient business operations. Data are needed on the scale and significance of tourism. Information on the role of tourism in national economies is particularly deficient. Although the World Tourism Organization reports progress in harmonizing definitions and measurement, differences in national practices still prevent full comparability.

Arrivals data measure the flows of international visitors to the country of reference: each arrival corresponds to one in inbound tourism trip. If a person visits several countries during the course of a single trip, his/her arrival in each country is recorded separately. In an accounting period, arrivals are not necessarily equal to the number of persons travelling (when a person visits the same country several times a year, each trip by the same person is counted as a separate arrival).

Arrivals data should correspond to inbound visitors by including both tourists and same-day non-resident visitors. All other types of travelers (such as border, seasonal and other short-term workers, long-term students and others) should be excluded as they do not qualify as visitors.

Data are obtained from different sources: administrative records (immigration, traffic counts, and other possible types of controls), border surveys or a mix of them. If data are obtained from accommodation surveys, the number of guests is used as estimate of arrival figures; consequently, in this case, breakdowns by regions, main purpose of the trip, modes of transport used or forms of organization of the trip are based on complementary visitor surveys.","Tourism is officially recognized as a directly measurable activity, enabling more accurate analysis and more effective policy. Whereas previously the sector relied mostly on approximations from related areas of measurement (e.g. Balance of Payments statistics), tourism today possesses a range of instruments to track its productive activities and the activities of the consumers that drive them: visitors (both tourists and excursionists).

An increasing number of countries have opened up and invested in tourism development, making tourism a key driver of socio-economic progress through export revenues, the creation of jobs and enterprises, and infrastructure development. As an internationally traded service, inbound tourism has become one of the world's major trade categories. For many developing countries it is one of the main sources of foreign exchange income and a major component of exports, creating much needed employment and development opportunities.","Tourism can be either domestic or international. The data refers to international tourism, where the traveler's country of residence differs from the visiting country. International tourism consists of inbound (arrival) and outbound (departures) tourism.

The data are from the World Tourism Organization (WTO), a United Nations agency. The data on inbound and outbound tourists refer to the number of arrivals and departures, not to the number of people traveling. Thus a person who makes several trips to a country during a given period is counted each time as a new arrival. The data on inbound tourism show the arrivals of nonresident tourists (overnight visitors) at national borders. When data on international tourists are unavailable or incomplete, the data show the arrivals of international visitors, which include tourists, same-day visitors, cruise passengers, and crew members.

Sources and collection methods for arrivals differ across countries. In some cases data are from border statistics (police, immigration, and the like) and supplemented by border surveys. In other cases data are from tourism accommodation establishments. For some countries number of arrivals is limited to arrivals by air and for others to arrivals staying in hotels. Some countries include arrivals of nationals residing abroad while others do not. Caution should thus be used in comparing arrivals across countries.",,,,https://datacatalog.worldbank.org/public-licenses#cc-by
SI.DST.10TH.10,CC BY-4.0,Income share held by highest 10%,Percentage share of income or consumption that accrues to the 10th (wealthiest) decile.,Percentage share of income or consumption is the share that accrues to subgroups of population indicated by deciles or quintiles.,"World Bank, Poverty and Inequality Platform. Data are based on primary household survey data obtained from government statistical agencies and World Bank country departments. Data for high-income economies are mostly from the Luxembourg Income Study database. For more information and methodology, please see http://pip.worldbank.org.",Poverty: Income distribution,%,Annual,,,"Inequality in the distribution of income is reflected in the share of income or consumption accruing to a portion of the population ranked by income or consumption levels. The portions ranked lowest by personal income receive the smallest shares of total income.

Data on the distribution of income or consumption come from nationally representative household surveys. Where the original data from the household survey were available, they have been used to directly calculate the income or consumption shares by quintile. Otherwise, shares have been estimated from the best available grouped data.

The distribution data have been adjusted for household size, providing a more consistent measure of per capita income or consumption. 

The year reflects the year in which the underlying household survey data were collected or, when the data collection period bridged two calendar years, the year data collection started.",The World Bank Group's goal of promoting shared prosperity has been defined as fostering income growth of the bottom 40 per cent of the welfare distribution in every country. Income distribution measures are important background indicators for shared prosperity.,"Despite progress in the last decade, the challenges of measuring poverty remain. The timeliness, frequency, quality, and comparability of household surveys need to increase substantially, particularly in the poorest countries. The availability and quality of poverty monitoring data remains low in small states, countries with fragile situations, and low-income countries and even some middle-income countries. The low frequency and lack of comparability of the data available in some countries create uncertainty over the magnitude of poverty reduction. 

Besides the frequency and timeliness of survey data, other data quality issues arise in measuring household living standards. The surveys ask detailed questions on sources of income and how it was spent, which must be carefully recorded by trained personnel. Income is generally more difficult to measure accurately, and consumption comes closer to the notion of living standards. And income can vary over time even if living standards do not. But consumption data are not always available: the latest estimates reported here use consumption data for about two-thirds of countries.

However, even similar surveys may not be strictly comparable because of differences in timing or in the quality and training of enumerators. Comparisons of countries at different levels of development also pose a potential problem because of differences in the relative importance of the consumption of nonmarket goods. The local market value of all consumption in kind (including own production, particularly important in underdeveloped rural economies) should be included in total consumption expenditure but may not be. Most survey data now include valuations for consumption or income from own production, but valuation methods vary.",The World Bank’s internationally comparable poverty monitoring database now draws on income or detailed consumption data from more than 2000 household surveys across 169 countries. See the Poverty and Inequality Platform (PIP) for details (www.pip.worldbank.org).,,"World Bank, Poverty and Inequality Platform: https://pip.worldbank.org/",https://datacatalog.worldbank.org/public-licenses#cc-by
SI.DST.FRST.10,CC BY-4.0,Income share held by lowest 10%,Percentage share of income or consumption that accrues to the first (poorest) decile.,Percentage share of income or consumption is the share that accrues to subgroups of population indicated by deciles or quintiles.,"World Bank, Poverty and Inequality Platform. Data are based on primary household survey data obtained from government statistical agencies and World Bank country departments. Data for high-income economies are mostly from the Luxembourg Income Study database. For more information and methodology, please see http://pip.worldbank.org.",Poverty: Income distribution,%,Annual,,,"Inequality in the distribution of income is reflected in the share of income or consumption accruing to a portion of the population ranked by income or consumption levels. The portions ranked lowest by personal income receive the smallest shares of total income.

Data on the distribution of income or consumption come from nationally representative household surveys. Where the original data from the household survey were available, they have been used to directly calculate the income or consumption shares by quintile. Otherwise, shares have been estimated from the best available grouped data.

The distribution data have been adjusted for household size, providing a more consistent measure of per capita income or consumption. No adjustment has been made for spatial differences in cost of living within countries, because the data needed for such calculations are generally unavailable. For further details on the estimation method for low- and middle-income economies, see Ravallion and Chen (1996).

Survey year is the year in which the underlying household survey data were collected or, when the data collection period bridged two calendar years, the year in which most of the data were collected.",The World Bank Group's goal of promoting shared prosperity has been defined as fostering income growth of the bottom 40 per cent of the welfare distribution in every country. Income distribution measures are important background indicators for shared prosperity.,"Despite progress in the last decade, the challenges of measuring poverty remain. The timeliness, frequency, quality, and comparability of household surveys need to increase substantially, particularly in the poorest countries. The availability and quality of poverty monitoring data remains low in small states, countries with fragile situations, and low-income countries and even some middle-income countries. The low frequency and lack of comparability of the data available in some countries create uncertainty over the magnitude of poverty reduction. 

Besides the frequency and timeliness of survey data, other data quality issues arise in measuring household living standards. The surveys ask detailed questions on sources of income and how it was spent, which must be carefully recorded by trained personnel. Income is generally more difficult to measure accurately, and consumption comes closer to the notion of living standards. And income can vary over time even if living standards do not. But consumption data are not always available: the latest estimates reported here use consumption data for about two-thirds of countries.

However, even similar surveys may not be strictly comparable because of differences in timing or in the quality and training of enumerators. Comparisons of countries at different levels of development also pose a potential problem because of differences in the relative importance of the consumption of nonmarket goods. The local market value of all consumption in kind (including own production, particularly important in underdeveloped rural economies) should be included in total consumption expenditure but may not be. Most survey data now include valuations for consumption or income from own production, but valuation methods vary.",The World Bank’s internationally comparable poverty monitoring database now draws on income or detailed consumption data from more than 2000 household surveys across 169 countries. See the Poverty and Inequality Platform (PIP) for details (www.pip.worldbank.org).,,"World Bank, Poverty and Inequality Platform: https://pip.worldbank.org/",https://datacatalog.worldbank.org/public-licenses#cc-by
SI.DST.02ND.20,CC BY-4.0,Income share held by second 20%,Percentage share of income or consumption that accrues to the second quintile.,Percentage share of income or consumption is the share that accrues to subgroups of population indicated by deciles or quintiles. Percentage shares by quintile may not sum to 100 because of rounding.,"World Bank, Poverty and Inequality Platform. Data are based on primary household survey data obtained from government statistical agencies and World Bank country departments. Data for high-income economies are mostly from the Luxembourg Income Study database. For more information and methodology, please see http://pip.worldbank.org.",Poverty: Income distribution,%,Annual,,,"Inequality in the distribution of income is reflected in the share of income or consumption accruing to a portion of the population ranked by income or consumption levels. The portions ranked lowest by personal income receive the smallest shares of total income.

Data on the distribution of income or consumption come from nationally representative household surveys. Where the original data from the household survey were available, they have been used to directly calculate the income or consumption shares by quintile. Otherwise, shares have been estimated from the best available grouped data.

The distribution data have been adjusted for household size, providing a more consistent measure of per capita income or consumption. 

The year reflects the year in which the underlying household survey data were collected or, when the data collection period bridged two calendar years, the year data collection started.

Percentage shares by quintile may not sum to 100 because of rounding.",The World Bank Group's goal of promoting shared prosperity has been defined as fostering income growth of the bottom 40 per cent of the welfare distribution in every country. Income distribution measures are important background indicators for shared prosperity.,"Despite progress in the last decade, the challenges of measuring poverty remain. The timeliness, frequency, quality, and comparability of household surveys need to increase substantially, particularly in the poorest countries. The availability and quality of poverty monitoring data remains low in small states, countries with fragile situations, and low-income countries and even some middle-income countries. The low frequency and lack of comparability of the data available in some countries create uncertainty over the magnitude of poverty reduction. 

Besides the frequency and timeliness of survey data, other data quality issues arise in measuring household living standards. The surveys ask detailed questions on sources of income and how it was spent, which must be carefully recorded by trained personnel. Income is generally more difficult to measure accurately, and consumption comes closer to the notion of living standards. And income can vary over time even if living standards do not. But consumption data are not always available: the latest estimates reported here use consumption data for about two-thirds of countries.

However, even similar surveys may not be strictly comparable because of differences in timing or in the quality and training of enumerators. Comparisons of countries at different levels of development also pose a potential problem because of differences in the relative importance of the consumption of nonmarket goods. The local market value of all consumption in kind (including own production, particularly important in underdeveloped rural economies) should be included in total consumption expenditure but may not be. Most survey data now include valuations for consumption or income from own production, but valuation methods vary.",The World Bank’s internationally comparable poverty monitoring database now draws on income or detailed consumption data from more than 2000 household surveys across 169 countries. See the Poverty and Inequality Platform (PIP) for details (www.pip.worldbank.org).,,"World Bank, Poverty and Inequality Platform: https://pip.worldbank.org/",https://datacatalog.worldbank.org/public-licenses#cc-by
