CM.MKT.LDOM.NO,CC BY-4.0,"Listed domestic companies, total",,"Listed domestic companies, including foreign companies which are exclusively listed, are those which have shares listed on an exchange at the end of the year. Investment funds, unit trusts, and companies whose only business goal is to hold shares of other listed companies, such as holding companies and investment companies, regardless of their legal status, are excluded. A company with several classes of shares is counted once. Only companies admitted to listing on the exchange are included.",World Federation of Exchanges database.,Financial Sector: Capital markets,,Annual,,Sum,"A company is considered domestic when it is incorporated in the same country as where the exchange is located. The only exception is the case of foreign companies which are exclusively listed on an exchange (i.e., the foreign company is not listed on any other exchange as defined in the domestic market capitalization definition).","Stock market size can be measured in various ways, and each may produce a different ranking of countries.

The development of an economy's financial markets is closely related to its overall development. Well-functioning financial systems provide good and easily accessible information which can lower transaction costs and subsequently improve resource allocation and boosts economic growth. Both banking systems and stock markets enhance growth, the main factor in poverty reduction. At low levels of economic development commercial banks tend to dominate the financial system, while at higher levels domestic stock markets tend to become more active and efficient relative to domestic banks.

Open economies with sound macroeconomic policies, good legal systems, and shareholder protection attract capital and therefore have larger financial markets. Recent research on stock market development shows that modern communications technology and increased financial integration have resulted in more cross-border capital flows, a stronger presence of financial firms around the world, and the migration of stock exchange activities to international exchanges. Many firms in emerging markets now cross-list on international exchanges, which provides them with lower cost capital and more liquidity-traded shares. However, this also means that exchanges in emerging markets may not have enough financial activity to sustain them, putting pressure on them to rethink their operations.","Data cover measures of size (market capitalization, number of listed domestic companies) and liquidity (value of shares traded as a percentage of gross domestic product, value of shares traded as a percentage of market capitalization). The comparability of such data across countries may be limited by conceptual and statistical weaknesses, such as inaccurate reporting and differences in accounting standards.",Stock market data were previously sourced from Standard & Poor's until they discontinued their "Global Stock Markets Factbook" and database in April 2013. Time series have been replaced in December 2015 with data from the World Federation of Exchanges and may differ from the previous S&P definitions and methodology.,,,https://datacatalog.worldbank.org/public-licenses#cc-by
NY.ADJ.NNTY.PC.KD.ZG,CC BY-4.0,Adjusted net national income per capita (annual % growth),,Adjusted net national income is GNI minus consumption of fixed capital and natural resources depletion.,World Bank staff estimates based on sources and methods in World Bank's "The Changing Wealth of Nations: Measuring Sustainable Development in the New Millennium" (2011).,Economic Policy & Debt: National accounts: Adjusted savings & income,,Annual,,Weighted average,"Adjusted net national income complements gross national income (GNI) in assessing economic progress (Hamilton and Ley 2010) by providing a broader measure of national income that accounts for the depletion of natural resources.

Adjusted net national income is calculated by subtracting from GNI a charge for the consumption of fixed capital (a calculation that yields net national income) and for the depletion of natural resources. The deduction for the depletion of natural resources, which covers net forest depletion, energy depletion, and mineral depletion, reflects the decline in asset values associated with the extraction and harvesting of natural resources. This is analogous to depreciation of fixed assets.

Growth rates of adjusted net national income are computed from constant price series deflated using the gross national expenditure (formerly domestic absorption) deflator.","Adjusted net national income is particularly useful in monitoring low-income, resource-rich economies, like many countries in Sub-Saharan Africa, because such economies often see large natural resources depletion as well as substantial exports of resource rents to foreign mining companies. For recent years adjusted net national income gives a picture of economic growth that is strikingly different from the one provided by GDP.

The key to increasing future consumption and thus the standard of living lies in increasing national wealth - including not only the traditional measures of capital (such as produced and human capital), but also natural capital. Natural capital comprises such assets as land, forests, and subsoil resources. All three types of capital are key to sustaining economic growth. By accounting for the consumption of fixed and natural capital depletion, adjusted net national income better measures the income available for consumption or for investment to increase a country's future consumption.","Adjusted net national income differs from the adjustments made in the calculation of adjusted net savings, by not accounting for investments in human capital or the damages from pollution. Thus, adjusted net national income remains within the boundaries of the United Nations System of National Accounts (SNA).

The SNA includes non-produced natural assets (such as land, mineral resources, and forests) within the asset boundary when they are under the effective control of institutional units. The calculation of adjusted net national income, which accounts for net forest, energy, and mineral depletion, as well as consumption of fixed capital, thus remains within the SNA boundaries. This point is critical because it allows for comparisons across GDP, GNI, and adjusted net national income; such comparisons reveal the impact of natural resource depletion, which is otherwise ignored by the popular economic indicators.",,,,https://datacatalog.worldbank.org/public-licenses#cc-by
NY.ADJ.NNTY.KD.ZG,CC BY-4.0,Adjusted net national income (annual % growth),,Adjusted net national income is GNI minus consumption of fixed capital and natural resources depletion.,World Bank staff estimates based on sources and methods in World Bank's "The Changing Wealth of Nations: Measuring Sustainable Development in the New Millennium" (2011).,Economic Policy & Debt: National accounts: Adjusted savings & income,,Annual,,Weighted average,"Adjusted net national income complements gross national income (GNI) in assessing economic progress (Hamilton and Ley 2010) by providing a broader measure of national income that accounts for the depletion of natural resources.

Adjusted net national income is calculated by subtracting from GNI a charge for the consumption of fixed capital (a calculation that yields net national income) and for the depletion of natural resources. The deduction for the depletion of natural resources, which covers net forest depletion, energy depletion, and mineral depletion, reflects the decline in asset values associated with the extraction and harvesting of natural resources. This is analogous to depreciation of fixed assets.

Growth rates of adjusted net national income are computed from constant price series deflated using the gross national expenditure (formerly domestic absorption) deflator.","Adjusted net national income is particularly useful in monitoring low-income, resource-rich economies, like many countries in Sub-Saharan Africa, because such economies often see large natural resources depletion as well as substantial exports of resource rents to foreign mining companies. For recent years adjusted net national income gives a picture of economic growth that is strikingly different from the one provided by GDP.

The key to increasing future consumption and thus the standard of living lies in increasing national wealth - including not only the traditional measures of capital (such as produced and human capital), but also natural capital. Natural capital comprises such assets as land, forests, and subsoil resources. All three types of capital are key to sustaining economic growth. By accounting for the consumption of fixed and natural capital depletion, adjusted net national income better measures the income available for consumption or for investment to increase a country's future consumption.","Adjusted net national income differs from the adjustments made in the calculation of adjusted net savings, by not accounting for investments in human capital or the damages from pollution. Thus, adjusted net national income remains within the boundaries of the United Nations System of National Accounts (SNA).

The SNA includes non-produced natural assets (such as land, mineral resources, and forests) within the asset boundary when they are under the effective control of institutional units. The calculation of adjusted net national income, which accounts for net forest, energy, and mineral depletion, as well as consumption of fixed capital, thus remains within the SNA boundaries. This point is critical because it allows for comparisons across GDP, GNI, and adjusted net national income; such comparisons reveal the impact of natural resource depletion, which is otherwise ignored by the popular economic indicators.",,,,https://datacatalog.worldbank.org/public-licenses#cc-by
NY.ADJ.AEDU.GN.ZS,CC BY-4.0,Adjusted savings: education expenditure (% of GNI),,"Education expenditure refers to the current operating expenditures in education, including wages and salaries and excluding capital investments in buildings and equipment.","World Bank staff estimates using data from the United Nations Statistics Division's Statistical Yearbook, and the UNESCO Institute for Statistics online database.",Economic Policy & Debt: National accounts: Adjusted savings & income,,Annual,,Weighted average,,,"Public education expenditures are considered an addition to savings. However, because of the wide variability in the effectiveness of public education expenditures, these figures cannot be construed as the value of investments in human capital. A current expenditure of $1 on education does not necessarily yield $1 of human capital. The calculation should also consider private education expenditure, but data are not available for a large number of countries.",,,,https://datacatalog.worldbank.org/public-licenses#cc-by
SL.EMP.MPYR.FE.ZS,CC BY-4.0,"Employers, female (% of female employment) (modeled ILO estimate)",,"Employers are those workers who, working on their own account or with one or a few partners, hold the type of jobs defined as a "self-employment jobs" i.e. jobs where the remuneration is directly dependent upon the profits derived from the goods and services produced), and, in this capacity, have engaged, on a continuous basis, one or more persons to work for them as employee(s).",International Labour Organization. “ILO modelled estimates database” ILOSTAT. Accessed January 2021. https://ilostat.ilo.org/data/.,Social Protection & Labor: Economic activity,,Annual,,Weighted average,"The status in employment distinguishes between two categories of the total employed: (a) wage and salaried workers (also known as employees); and (b) self-employed workers, with the subcategories: (i) self-employed workers with employees (employers), (ii) self-employed workers without employees (own-account workers), and (iii) members of producers' cooperatives and contributing family workers (also known as unpaid family workers). Vulnerable employment refers to the sum of (ii) own-account workers and (iii) contributing family workers.

The series is part of the "ILO modeled estimates database," including nationally reported observations and imputed data for countries with missing data, primarily to capture regional and global trends with consistent country coverage. Country-reported microdata is based mainly on nationally representative labor force surveys, with other sources (e.g., household surveys and population censuses) considering differences in the data source, the scope of coverage, methodology, and other country-specific factors. Country analysis requires caution where limited nationally reported data are available. A series of models are also applied to impute missing observations and make projections. However, imputed observations are not based on national data, are subject to high uncertainty, and should not be used for country comparisons or rankings. For more information: https://ilostat.ilo.org/resources/concepts-and-definitions/ilo-modelled-estimates/","Breaking down employment information by status in employment provides a statistical basis for describing workers' behaviour and conditions of work, and for defining an individual's socio-economic group. A high proportion of wage and salaried workers in a country can signify advanced economic development. If the proportion of own-account workers (self-employed without hired employees) is sizeable, it may be an indication of a large agriculture sector and low growth in the formal economy. A high proportion of contributing family workers — generally unpaid, although compensation might come indirectly in the form of family income — may indicate weak development, little job growth, and often a large rural economy.

Each status group faces different economic risks, and contributing family workers and own-account workers are the most vulnerable - and therefore the most likely to fall into poverty. They are the least likely to have formal work arrangements, are the least likely to have social protection and safety nets to guard against economic shocks, and often are incapable of generating sufficient savings to offset these shocks.","Data are drawn from labor force surveys and household surveys, supplemented by official estimates and censuses for a small group of countries. Due to differences in definitions and coverage across countries, there are limitations for comparing data across countries and over time even within a country. Estimates of women in employment are not comparable internationally, reflecting that demographic, social, legal, and cultural trends and norms determine whether women's activities are regarded as economic.",,"Given the exceptional situation, including the scarcity of relevant data, the  ILO modeled estimates and projections from 2020 onwards are subject to substantial uncertainty.",,https://datacatalog.worldbank.org/public-licenses#cc-by
SL.FAM.WORK.MA.ZS,CC BY-4.0,"Contributing family workers, male (% of male employment) (modeled ILO estimate)",,Contributing family workers are those workers who hold "self-employment jobs" as own-account workers in a market-oriented establishment operated by a related person living in the same household.,International Labour Organization. “ILO modelled estimates database” ILOSTAT. Accessed January 2021. https://ilostat.ilo.org/data/.,Social Protection & Labor: Economic activity,,Annual,,Weighted average,"The status in employment distinguishes between two categories of the total employed: (a) wage and salaried workers (also known as employees); and (b) self-employed workers, with the subcategories: (i) self-employed workers with employees (employers), (ii) self-employed workers without employees (own-account workers), and (iii) members of producers' cooperatives and contributing family workers (also known as unpaid family workers). Vulnerable employment refers to the sum of (ii) own-account workers and (iii) contributing family workers.

The series is part of the "ILO modeled estimates database," including nationally reported observations and imputed data for countries with missing data, primarily to capture regional and global trends with consistent country coverage. Country-reported microdata is based mainly on nationally representative labor force surveys, with other sources (e.g., household surveys and population censuses) considering differences in the data source, the scope of coverage, methodology, and other country-specific factors. Country analysis requires caution where limited nationally reported data are available. A series of models are also applied to impute missing observations and make projections. However, imputed observations are not based on national data, are subject to high uncertainty, and should not be used for country comparisons or rankings. For more information: https://ilostat.ilo.org/resources/concepts-and-definitions/ilo-modelled-estimates/","Breaking down employment information by status in employment provides a statistical basis for describing workers' behaviour and conditions of work, and for defining an individual's socio-economic group. A high proportion of wage and salaried workers in a country can signify advanced economic development. If the proportion of own-account workers (self-employed without hired employees) is sizeable, it may be an indication of a large agriculture sector and low growth in the formal economy. A high proportion of contributing family workers — generally unpaid, although compensation might come indirectly in the form of family income — may indicate weak development, little job growth, and often a large rural economy.

Each status group faces different economic risks, and contributing family workers and own-account workers are the most vulnerable - and therefore the most likely to fall into poverty. They are the least likely to have formal work arrangements, are the least likely to have social protection and safety nets to guard against economic shocks, and often are incapable of generating sufficient savings to offset these shocks.","Data are drawn from labor force surveys and household surveys, supplemented by official estimates and censuses for a small group of countries. Due to differences in definitions and coverage across countries, there are limitations for comparing data across countries and over time even within a country. Estimates of women in employment are not comparable internationally, reflecting that demographic, social, legal, and cultural trends and norms determine whether women's activities are regarded as economic.",,"Given the exceptional situation, including the scarcity of relevant data, the  ILO modeled estimates and projections from 2020 onwards are subject to substantial uncertainty.",,https://datacatalog.worldbank.org/public-licenses#cc-by
SL.FAM.WORK.ZS,CC BY-4.0,"Contributing family workers, total (% of total employment) (modeled ILO estimate)",,Contributing family workers are those workers who hold "self-employment jobs" as own-account workers in a market-oriented establishment operated by a related person living in the same household.,International Labour Organization. “ILO modelled estimates database” ILOSTAT. Accessed January 2021. https://ilostat.ilo.org/data/.,Social Protection & Labor: Economic activity,,Annual,,Weighted average,"The status in employment distinguishes between two categories of the total employed: (a) wage and salaried workers (also known as employees); and (b) self-employed workers, with the subcategories: (i) self-employed workers with employees (employers), (ii) self-employed workers without employees (own-account workers), and (iii) members of producers' cooperatives and contributing family workers (also known as unpaid family workers). Vulnerable employment refers to the sum of (ii) own-account workers and (iii) contributing family workers.

The series is part of the "ILO modeled estimates database," including nationally reported observations and imputed data for countries with missing data, primarily to capture regional and global trends with consistent country coverage. Country-reported microdata is based mainly on nationally representative labor force surveys, with other sources (e.g., household surveys and population censuses) considering differences in the data source, the scope of coverage, methodology, and other country-specific factors. Country analysis requires caution where limited nationally reported data are available. A series of models are also applied to impute missing observations and make projections. However, imputed observations are not based on national data, are subject to high uncertainty, and should not be used for country comparisons or rankings. For more information: https://ilostat.ilo.org/resources/concepts-and-definitions/ilo-modelled-estimates/","Breaking down employment information by status in employment provides a statistical basis for describing workers' behaviour and conditions of work, and for defining an individual's socio-economic group. A high proportion of wage and salaried workers in a country can signify advanced economic development. If the proportion of own-account workers (self-employed without hired employees) is sizeable, it may be an indication of a large agriculture sector and low growth in the formal economy. A high proportion of contributing family workers — generally unpaid, although compensation might come indirectly in the form of family income — may indicate weak development, little job growth, and often a large rural economy.

Each status group faces different economic risks, and contributing family workers and own-account workers are the most vulnerable - and therefore the most likely to fall into poverty. They are the least likely to have formal work arrangements, are the least likely to have social protection and safety nets to guard against economic shocks, and often are incapable of generating sufficient savings to offset these shocks.","Data are drawn from labor force surveys and household surveys, supplemented by official estimates and censuses for a small group of countries. Due to differences in definitions and coverage across countries, there are limitations for comparing data across countries and over time even within a country. Estimates of women in employment are not comparable internationally, reflecting that demographic, social, legal, and cultural trends and norms determine whether women's activities are regarded as economic.",,"Given the exceptional situation, including the scarcity of relevant data, the  ILO modeled estimates and projections from 2020 onwards are subject to substantial uncertainty.",,https://datacatalog.worldbank.org/public-licenses#cc-by
